{
  "$schema": "../profile.schema.json",
  "id": "vodafone-net",
  "displayName": "Vodafone Net",
  "asns": [
    15924,
    8386
  ],
  "orgKeywords": [
    "vodafone"
  ],
  "engine": "winws",
  "priority": 3,
  "notes": "AS15924 (eski Borusan Telekom) ve AS8386 (eski Koc.net): ikisi de sabit hat. \"vodafone\" anahtar kelimesi Vodafone Mobil'le de eslesir; tespit ASN'ye gore birini onerip kullaniciya sorar. Bildirilen strateji sahte paket ve bolmeyi birlikte kullaniyor. 2026-09-15 (issue #1, kullanici raporu): tcp443 ve tcp80 adaylari gercek AS8386 hattinda dogrulandi; QUIC bolumunde 25 adayin HEPSI zaman asimina ugradi, yani bu hatta calisan bir QUIC adayi bilinmiyor ve o bolum komuta hic girmiyor. 2026-09-16 (issue #1, ikinci rapor, 0.2.3): ayni iki aday yine kazandi; QUIC'te 12 aday denenip cevapsiz bolum kuraliyla birakildi. Rapor ASN numarasi yazmiyor ve baglanti Wi-Fi; kullanici bu kosumun da Vodafone Net ev internetinde yapildigini teyit etti.",
  "candidates": [
    {
      "id": "vf-443-fake-multisplit-badseq",
      "section": "tcp443",
      "args": "--dpi-desync=fake,multisplit --dpi-desync-fooling=badseq --dpi-desync-split-pos=1,midsld",
      "protocols": [
        "tls12",
        "tls13"
      ],
      "weight": 100,
      "source": "verified",
      "verifiedFor": [
        "discord",
        "discord-guncelleme"
      ],
      "lastVerified": "2026-09-16",
      "note": "DOGRULANDI (saha, issue #1): gercek AS8386 Vodafone Net hattinda discord.com, gateway.discord.gg ve updates.discord.com baglantilarini acti. Baseline'da ucu de RST veriyordu. IKI KOSUM: 2026-09-15 (hat AS8386 olarak tespit edildi) ve 2026-09-16 (kullanici ev internetinde yaptigini teyit etti), kullanici bildirimi (rapor dosyalari issue #1'e ekli) -- gelistirici olcumlerindeki 3/3 kontrollu tekrar DEGIL. DIKKAT: bu aday --dpi-desync-fooling=badseq kullaniyor, yani sahte paket TTL ile yolda olmez, gercek sunucuya bozuk sequence numarasiyla ulasir. Ayni kullanici koruma acikken GitHub'in calismadigini bildirdi; 0.2.2'den itibaren strateji yalnizca hostlist'teki adreslere uygulandigi icin bu yan hasar Discord alan adlariyla sinirli."
    },
    {
      "id": "vf-443-fake-multidisorder",
      "section": "tcp443",
      "args": "--dpi-desync=fake,multidisorder --dpi-desync-split-pos=midsld --dpi-desync-repeats=6 --dpi-desync-fooling=badseq,md5sig",
      "protocols": [
        "tls12",
        "tls13"
      ],
      "weight": 85,
      "source": "upstream-preset",
      "verifiedFor": [],
      "lastVerified": null,
      "note": "Upstream genel 443 kurali."
    },
    {
      "id": "vf-443-multisplit-midsld",
      "section": "tcp443",
      "args": "--dpi-desync=multisplit --dpi-desync-split-pos=midsld",
      "protocols": [
        "tls12",
        "tls13"
      ],
      "weight": 70,
      "source": "hypothesis",
      "verifiedFor": [],
      "lastVerified": null,
      "note": "Saf bolme ailesi."
    },
    {
      "id": "vf-80-fake-fakedsplit",
      "section": "tcp80",
      "args": "--dpi-desync=fake,fakedsplit --dpi-desync-autottl=2 --dpi-desync-fooling=md5sig",
      "protocols": [
        "http"
      ],
      "weight": 100,
      "source": "verified",
      "verifiedFor": [
        "discord"
      ],
      "lastVerified": "2026-09-16",
      "note": "DOGRULANDI (saha, issue #1): gercek AS8386 Vodafone Net hattinda duz HTTP'de discord.com'u acti (baseline'da RST). IKI KOSUM: 2026-09-15 (hat AS8386 olarak tespit edildi) ve 2026-09-16 (kullanici ev internetinde yaptigini teyit etti), kullanici bildirimi (rapor dosyalari issue #1'e ekli) -- 3/3 kontrollu tekrar DEGIL."
    },
    {
      "id": "vf-80-multisplit-method",
      "section": "tcp80",
      "args": "--dpi-desync=multisplit --dpi-desync-split-pos=method+2",
      "protocols": [
        "http"
      ],
      "weight": 80,
      "source": "hypothesis",
      "verifiedFor": [],
      "lastVerified": null,
      "note": "Host basligini ayri segmente atar."
    },
    {
      "id": "vf-quic-fake-google",
      "section": "quic",
      "args": "--dpi-desync=fake --dpi-desync-repeats=11 --dpi-desync-fake-quic={FAKE_QUIC_GOOGLE}",
      "protocols": [
        "quic"
      ],
      "weight": 100,
      "source": "upstream-preset",
      "verifiedFor": [],
      "lastVerified": null,
      "note": "UDP parcalanamaz; QUIC'te tek yol sahte Initial paketi."
    },
    {
      "id": "vf-quic-fake-plain",
      "section": "quic",
      "args": "--dpi-desync=fake --dpi-desync-repeats=11",
      "protocols": [
        "quic"
      ],
      "weight": 90,
      "source": "upstream-preset",
      "verifiedFor": [],
      "lastVerified": null,
      "note": "Hazir yuk olmadan sahte QUIC."
    },
    {
      "id": "vf-voice-fake",
      "section": "discord-voice",
      "args": "--dpi-desync=fake",
      "protocols": [
        "udp"
      ],
      "weight": 100,
      "source": "upstream-preset",
      "verifiedFor": [],
      "lastVerified": null,
      "note": "Discord ses/STUN bolumu. TCP stratejisinden bagimsiz test edilir."
    }
  ]
}
