{
  "$schema": "../profile.schema.json",
  "id": "turknet",
  "displayName": "TurkNet",
  "asns": [
    12735
  ],
  "orgKeywords": [
    "turknet"
  ],
  "engine": "winws",
  "priority": 4,
  "notes": "AS12735. ISP'ye ozel bildirilmis strateji bulunamadi, genel merdivenle baslanir. KULLANICI BILDIRIMI, OLCULMEDI (issue #1, KeremKuyucu, 2026-09-16): TurkNet'i 1,5 yil, Temmuz 2026'ya kadar kullanmis; engel yalnizca DNS'teymis, DNS sunucusunu degistirmek (sifreli olmasi bile gerekmeden) yetiyormus. Dogruysa bu hatta DPI adayi gerekmez ve sifreli DNS acikken test hedefleri acik bulur (ENGEL BULUNAMADI). Ilk TurkNet saha raporunda bakilacaklar: sistem DNS'iyle baseline DNS YONLEND. mi, --doh ile hedefler aciliyor mu, DPI ENGELI var mi.",
  "candidates": [
    {
      "id": "tn-443-fake-multidisorder",
      "section": "tcp443",
      "args": "--dpi-desync=fake,multidisorder --dpi-desync-split-pos=midsld --dpi-desync-repeats=6 --dpi-desync-fooling=badseq,md5sig",
      "protocols": [
        "tls12",
        "tls13"
      ],
      "weight": 100,
      "source": "upstream-preset",
      "verifiedFor": [],
      "lastVerified": null,
      "note": "Upstream genel 443 kurali; ISP'ye ozel veri olmadigi icin baslangic noktasi."
    },
    {
      "id": "tn-443-multisplit-midsld",
      "section": "tcp443",
      "args": "--dpi-desync=multisplit --dpi-desync-split-pos=midsld",
      "protocols": [
        "tls12",
        "tls13"
      ],
      "weight": 85,
      "source": "hypothesis",
      "verifiedFor": [],
      "lastVerified": null,
      "note": "Saf bolme ailesi."
    },
    {
      "id": "tn-443-fake-badseq",
      "section": "tcp443",
      "args": "--dpi-desync=fake --dpi-desync-fooling=badseq",
      "protocols": [
        "tls12",
        "tls13"
      ],
      "weight": 70,
      "source": "hypothesis",
      "verifiedFor": [],
      "lastVerified": null,
      "note": "Sunucudan bagimsiz fooling."
    },
    {
      "id": "tn-80-fake-fakedsplit",
      "section": "tcp80",
      "args": "--dpi-desync=fake,fakedsplit --dpi-desync-autottl=2 --dpi-desync-fooling=md5sig",
      "protocols": [
        "http"
      ],
      "weight": 100,
      "source": "upstream-preset",
      "verifiedFor": [],
      "lastVerified": null,
      "note": "Upstream'in duz HTTP kurali."
    },
    {
      "id": "tn-80-multisplit-method",
      "section": "tcp80",
      "args": "--dpi-desync=multisplit --dpi-desync-split-pos=method+2",
      "protocols": [
        "http"
      ],
      "weight": 80,
      "source": "hypothesis",
      "verifiedFor": [],
      "lastVerified": null,
      "note": "Host basligini ayri segmente atar."
    },
    {
      "id": "tn-quic-fake-google",
      "section": "quic",
      "args": "--dpi-desync=fake --dpi-desync-repeats=11 --dpi-desync-fake-quic={FAKE_QUIC_GOOGLE}",
      "protocols": [
        "quic"
      ],
      "weight": 100,
      "source": "upstream-preset",
      "verifiedFor": [],
      "lastVerified": null,
      "note": "UDP parcalanamaz; QUIC'te tek yol sahte Initial paketi."
    },
    {
      "id": "tn-quic-fake-plain",
      "section": "quic",
      "args": "--dpi-desync=fake --dpi-desync-repeats=11",
      "protocols": [
        "quic"
      ],
      "weight": 90,
      "source": "upstream-preset",
      "verifiedFor": [],
      "lastVerified": null,
      "note": "Hazir yuk olmadan sahte QUIC."
    },
    {
      "id": "tn-voice-fake",
      "section": "discord-voice",
      "args": "--dpi-desync=fake",
      "protocols": [
        "udp"
      ],
      "weight": 100,
      "source": "upstream-preset",
      "verifiedFor": [],
      "lastVerified": null,
      "note": "Discord ses/STUN bolumu. TCP stratejisinden bagimsiz test edilir."
    }
  ]
}
