{
  "$schema": "../profile.schema.json",
  "id": "netspeed",
  "displayName": "Netspeed",
  "asns": [
    206375
  ],
  "orgKeywords": [
    "netspeed"
  ],
  "engine": "winws",
  "priority": 7,
  "notes": "ISP'ye ozel bildirilmis strateji bulunamadi.",
  "candidates": [
    {
      "id": "ns-443-fake-multidisorder",
      "section": "tcp443",
      "args": "--dpi-desync=fake,multidisorder --dpi-desync-split-pos=midsld --dpi-desync-repeats=6 --dpi-desync-fooling=badseq,md5sig",
      "protocols": [
        "tls12",
        "tls13"
      ],
      "weight": 100,
      "source": "upstream-preset",
      "verifiedFor": [],
      "lastVerified": null,
      "note": "Upstream genel 443 kurali."
    },
    {
      "id": "ns-443-multisplit-midsld",
      "section": "tcp443",
      "args": "--dpi-desync=multisplit --dpi-desync-split-pos=midsld",
      "protocols": [
        "tls12",
        "tls13"
      ],
      "weight": 85,
      "source": "hypothesis",
      "verifiedFor": [],
      "lastVerified": null,
      "note": "Saf bolme ailesi."
    },
    {
      "id": "ns-80-fake-fakedsplit",
      "section": "tcp80",
      "args": "--dpi-desync=fake,fakedsplit --dpi-desync-autottl=2 --dpi-desync-fooling=md5sig",
      "protocols": [
        "http"
      ],
      "weight": 100,
      "source": "upstream-preset",
      "verifiedFor": [],
      "lastVerified": null,
      "note": "Upstream'in duz HTTP kurali."
    },
    {
      "id": "ns-80-multisplit-method",
      "section": "tcp80",
      "args": "--dpi-desync=multisplit --dpi-desync-split-pos=method+2",
      "protocols": [
        "http"
      ],
      "weight": 80,
      "source": "hypothesis",
      "verifiedFor": [],
      "lastVerified": null,
      "note": "Host basligini ayri segmente atar."
    },
    {
      "id": "ns-quic-fake-google",
      "section": "quic",
      "args": "--dpi-desync=fake --dpi-desync-repeats=11 --dpi-desync-fake-quic={FAKE_QUIC_GOOGLE}",
      "protocols": [
        "quic"
      ],
      "weight": 100,
      "source": "upstream-preset",
      "verifiedFor": [],
      "lastVerified": null,
      "note": "UDP parcalanamaz; QUIC'te tek yol sahte Initial paketi."
    },
    {
      "id": "ns-quic-fake-plain",
      "section": "quic",
      "args": "--dpi-desync=fake --dpi-desync-repeats=11",
      "protocols": [
        "quic"
      ],
      "weight": 90,
      "source": "upstream-preset",
      "verifiedFor": [],
      "lastVerified": null,
      "note": "Hazir yuk olmadan sahte QUIC."
    },
    {
      "id": "ns-voice-fake",
      "section": "discord-voice",
      "args": "--dpi-desync=fake",
      "protocols": [
        "udp"
      ],
      "weight": 100,
      "source": "upstream-preset",
      "verifiedFor": [],
      "lastVerified": null,
      "note": "Discord ses/STUN bolumu. TCP stratejisinden bagimsiz test edilir."
    }
  ]
}
