{
  "$schema": "../profile.schema.json",
  "id": "turkcell-mobil",
  "displayName": "Turkcell Mobil",
  "asns": [
    16135
  ],
  "orgKeywords": [
    "turkcell"
  ],
  "engine": "winws",
  "priority": 8,
  "notes": "Mobil sebekeler sabit hatlardan farkli DPI davranisi gosterebiliyor; ayri profil tutuluyor. OLCUMLE DOGRULANDI (2026-09-07, gercek AS16135 hatti): fark somut -- TTNET'te Discord TCP baglantisi RST ile sifirlanirken burada ZAMAN ASIMI veriyor, ve QUIC'te sahte yuk KULLANMAYAN aday kazaniyor, yuklu olan basarisiz. Yani mobil profili sabit hat profilinden turetmek yanlis olurdu. DOGRULANMIS PROFIL: elle bakim goruyor, tools/gen-seed-profiles.py tarafindan URETILMEZ -- yeniden uretim saha verisini silerdi. Olcum TETHERING (telefon hotspot) uzerinden yapildi; ayrinti adaylarin notlarinda.",
  "candidates": [
    {
      "id": "tcm-443-fake-autottl",
      "section": "tcp443",
      "args": "--dpi-desync=fake --dpi-desync-ttl=1 --dpi-desync-autottl=3",
      "protocols": [
        "tls12",
        "tls13"
      ],
      "weight": 100,
      "source": "verified",
      "verifiedFor": [
        "discord"
      ],
      "lastVerified": "2026-09-07",
      "note": "DOGRULANDI: gercek AS16135 hattinda, baseline'da zaman asimina ugrayan discord.com ve gateway.discord.gg baglantilarini acti (kontrollu tekrar 3/3). TETHERING uzerinden olculdu -- hotspot bir hop ekliyor. Bu aday autottl kullandigi icin hop sayisini kendi olcup seciyor, dolayisiyla USB modem/dongle ile dogrudan baglantida da tasinabilir olmasi bekleniyor; sabit TTL'li bir aday olsaydi bu garanti verilemezdi."
    },
    {
      "id": "tcm-443-fake-multidisorder",
      "section": "tcp443",
      "args": "--dpi-desync=fake,multidisorder --dpi-desync-split-pos=midsld --dpi-desync-repeats=6 --dpi-desync-fooling=badseq,md5sig",
      "protocols": [
        "tls12",
        "tls13"
      ],
      "weight": 85,
      "source": "upstream-preset",
      "verifiedFor": [],
      "lastVerified": null,
      "note": "Upstream genel 443 kurali."
    },
    {
      "id": "tcm-80-fake-fakedsplit",
      "section": "tcp80",
      "args": "--dpi-desync=fake,fakedsplit --dpi-desync-autottl=2 --dpi-desync-fooling=md5sig",
      "protocols": [
        "http"
      ],
      "weight": 100,
      "source": "upstream-preset",
      "verifiedFor": [],
      "lastVerified": null,
      "note": "Upstream'in duz HTTP kurali."
    },
    {
      "id": "tcm-80-multisplit-method",
      "section": "tcp80",
      "args": "--dpi-desync=multisplit --dpi-desync-split-pos=method+2",
      "protocols": [
        "http"
      ],
      "weight": 80,
      "source": "hypothesis",
      "verifiedFor": [],
      "lastVerified": null,
      "note": "Host basligini ayri segmente atar."
    },
    {
      "id": "tcm-quic-fake-google",
      "section": "quic",
      "args": "--dpi-desync=fake --dpi-desync-repeats=11 --dpi-desync-fake-quic={FAKE_QUIC_GOOGLE}",
      "protocols": [
        "quic"
      ],
      "weight": 80,
      "source": "upstream-preset",
      "verifiedFor": [],
      "lastVerified": null,
      "note": "OLCULDU: bu hatta ACMIYOR (kontrast tekrari 0/2, zaman asimi). Hazir yuk EKLEMEK burada zarar veriyor -- yuksuz hali (tcm-quic-fake-plain) calisiyor. Agirligi bu yuzden yuksuzun altina cekildi. TTNET'te tersi gecerli degil ama orada da bu aday tek basina yetmiyordu; yuk secimi hatta gore degisen bir eksen."
    },
    {
      "id": "tcm-quic-fake-plain",
      "section": "quic",
      "args": "--dpi-desync=fake --dpi-desync-repeats=11",
      "protocols": [
        "quic"
      ],
      "weight": 110,
      "source": "verified",
      "verifiedFor": [
        "discord"
      ],
      "lastVerified": "2026-09-07",
      "note": "DOGRULANDI: gercek AS16135 hattinda discord.com QUIC el sikismasini acti (kontrollu tekrar 3/3; ayni aday sahte yuk EKLENINCE 0/2). Dikkat: TTNET'te bu aday calismiyor, orada any-protocol+cutoff gerekiyordu. Sebep muhtemelen mobil DPI'in Initial paketini TTNET'teki gibi cozmeye calismamasi -- burada parcalanmis ClientHello sorunu hic ortaya cikmiyor. TETHERING uzerinden olculdu; bu aday TTL kullanmadigi icin hop sayisindan etkilenmiyor."
    },
    {
      "id": "tcm-voice-fake",
      "section": "discord-voice",
      "args": "--dpi-desync=fake",
      "protocols": [
        "udp"
      ],
      "weight": 100,
      "source": "upstream-preset",
      "verifiedFor": [],
      "lastVerified": null,
      "note": "Discord ses/STUN bolumu. TCP stratejisinden bagimsiz test edilir."
    }
  ]
}
